{
  "schema_version": 1,
  "workflow_version": "0.4.0",
  "linear_batch": "DRAGAI-62",
  "linear_issues": ["DRAGAI-67", "DRAGAI-68", "DRAGAI-69"],
  "batch_members": ["DRAGAI-67", "DRAGAI-68", "DRAGAI-69"],
  "issue_dag": [
    {"id": "DRAGAI-67", "dependencies": []},
    {"id": "DRAGAI-68", "dependencies": ["DRAGAI-67"]},
    {"id": "DRAGAI-69", "dependencies": ["DRAGAI-68"]}
  ],
  "repository_full_name": "AlexJJ009/agent-tools",
  "base_branch": "main",
  "base_sha": "1111111111111111111111111111111111111111",
  "working_branch": "linear/dragai-62-contract-validator-foundation",
  "candidate_sha": "2222222222222222222222222222222222222222",
  "github_pull_request": "AlexJJ009/agent-tools#6",
  "risk_profile": "high",
  "pull_request": {
    "github_pull_request": "AlexJJ009/agent-tools#6",
    "repository_full_name": "AlexJJ009/agent-tools",
    "base_branch": "main",
    "base_sha": "1111111111111111111111111111111111111111",
    "head_branch": "linear/dragai-62-contract-validator-foundation",
    "head_sha": "4444444444444444444444444444444444444444",
    "commit_shas": ["2222222222222222222222222222222222222222", "4444444444444444444444444444444444444444"],
    "draft": false
  },
  "commits": [
    {
      "sha": "2222222222222222222222222222222222222222",
      "subject": "feat(linear-workflow): validate evidence",
      "path_changes": [{"path": "linear_workflow/shared/runtime/src/linear_workflow_runtime/validators.py", "status": "modified"}]
    },
    {
      "sha": "4444444444444444444444444444444444444444",
      "subject": "docs(review): record round 1 verdict",
      "path_changes": [{"path": "linear_workflow/reviews/DRAGAI-62/round-1.json", "status": "added"}]
    }
  ],
  "required_checks": [
    {"name": "linear-workflow-runtime", "sha": "2222222222222222222222222222222222222222", "status": "success", "url": "https://github.com/AlexJJ009/agent-tools/actions/runs/1"}
  ],
  "base_review_verdicts": [],
  "review_verdicts": [
    {
      "round": 1,
      "candidate_sha": "2222222222222222222222222222222222222222",
      "reviewer": "independent-gpt-5.5",
      "independent_context": true,
      "verdict": "approved",
      "findings": [],
      "created_at": "2026-08-09T00:00:00Z",
      "artifact_path": "linear_workflow/reviews/DRAGAI-62/round-1.json",
      "artifact_commit": "4444444444444444444444444444444444444444"
    }
  ],
  "verdict_commit_path_changes": [{"path": "linear_workflow/reviews/DRAGAI-62/round-1.json", "status": "added"}],
  "reviewer_context": {
    "candidate_sha": "2222222222222222222222222222222222222222",
    "files": ["linear_workflow/shared/references/contribution-contract.md", "linear_workflow/shared/gate-policy.json"]
  },
  "changed_paths": ["linear_workflow/shared/runtime/src/linear_workflow_runtime/validators.py"],
  "gate_policy_source": "base",
  "gate_policy_sha": "1111111111111111111111111111111111111111",
  "gate_self_test": {"sha": "2222222222222222222222222222222222222222", "status": "success"}
}
